ID;targetAudience;pitchText;product_ID
97a84793-daa0-4aed-8e62-3a22a8dbcdb9;Guitar Enthusiasts;Check out our latest acoustic guitar!;a14dc87c-6768-4063-8d32-709357883868
f5dbefeb-9144-460d-9d05-e26683eae462;Music Schools;Perfect electric guitar for beginners;575c1863-7c33-410b-beae-e46d92cc4fab
7285786e-02be-477a-af3f-5384144c7468;Professional Musicians;Experience the best sound with our bass guitar;c8eeafa8-90e5-4383-8835-d3dd88d23bce
5c7682ab-60c2-4957-a24d-01abcde2df85;Music Producers;High quality ukulele for recording;2c222ea9-1fb9-4902-9a38-f2bcd1540ebd
b116dc6c-053d-4ffa-a345-0a16251f8115;Concert Organizers;Durable and reliable drum set for concerts;4851ca8e-daa9-4423-98a1-020fd238cc04